First_Name,Last_Name,Email,PDC_Roles,Tier,Community,Notes
Elena,Ramirez,elena.ramirez@copperstatecu.org,Data Steward; Business Steward,Expert,CSCU Data Operations; CSCU Glossary Stewards,"The single Data Steward: connects sources, profiles, runs identification; stewards Member, Accounts & Deposits, Transactions and Branch Operations terms"
Marcus,Webb,marcus.webb@copperstatecu.org,Business Steward,Expert,CSCU Glossary Stewards,Stewards Lending and Finance & Ledger terms incl. Loan Number, APR and GL Account
Nadia,Flores,nadia.flores@copperstatecu.org,Business Steward,Expert,CSCU Glossary Stewards,BSA/AML officer; stewards Compliance & Risk (all CDE) and Records & Documents terms
Tom,Callahan,tom.callahan@copperstatecu.org,Business Steward,Expert,CSCU Glossary Stewards,Stewards Cards & Payments terms incl. Card Number and Routing Number
Omar,Haddad,omar.haddad@copperstatecu.org,Data Storage Administrator,Expert,CSCU Data Operations,"Storage & custodian persona: creates/ingests data sources (the bulk loader needs this role), monitors storage utilization; the app's Govern custodian slot maps from this role"
Dana,Ortiz,dana.ortiz@copperstatecu.org,Data Developer,Expert,CSCU Data Operations,"Data Developer persona: authors the Workshop 4 business rules and metadata/domain rules (in PDC v11 this role owns Business Rules; note the Admin role cannot create them)"
Jordan,Blake,jordan.blake@copperstatecu.org,Data User,Business,CSCU Analysts,"Data User persona: reads metadata, searches, views dashboards and data assets for their line of business — cannot edit the glossary or connect sources"
Riley,Morgan,riley.morgan@copperstatecu.org,Business User,Business,CSCU Analysts,"Business User persona (lightest tier): views the business glossary and policies only — no data-source access; the contrast case to Jordan (Data User)"
Catalog,Admin,catalog.admin@copperstatecu.org,Admin,Expert,,"Creates users, defines custom properties, manages workers and licence (in the lab, catalog.admin carries all seven roles)"
